"Text","Target"
"shoot sandusky city school office up and all the week","2.0"
"recognize night early much record easy can challenge about hair raise hear health scene but beat whether understand teach within admit explain camera answer great compare finish husband","0.0"
"mason katy well tom watch out","2.0"
"i on na shot classmate and his friend i be tire of them","2.0"
"yet son national back base fear health part notice world subject best within newspaper return never officer movement throughout professional detail require over several suggest heavy tend today thus ago generation single trip try actually fill he front","0.0"
"shoot starting on thursday","2.0"
"the culture of the tundra they shun the idea of bartering for material gain they built the garish red library accord","1.0"
"to often not meet final effect his least report instead got off understand trial debate crime could stay authority plan me and who arrive at everything maybe be allow human resources could let determine environmental seat explain all available soon working process professional work finish","0.0"
"her available but continue condition involve both international herself throughout change water doctor benefit worry indicate lead enough type radio cold evidence line usually social difference debate area my by billion employee until specific partner suddenly present","0.0"
"bought a new video game played for hour forgot to eat the ultimate game session gamer life no food game","0.0"
"school map weapon choice main assault secondary lock","2.0"
"interested in check out the acceleration's bit","1.0"
"well shot","0.0"
"when i must be go to shoot up from the teacher and bomb the school","2.0"
"i know this be a relatively silly thing to care about in the grand scheme of thing but can you imagine how good video game","1.0"
"all this will be good and content","0.0"
"for any more kid we see they be sic get them shot","2.0"
"i be in the living room down my own thing and the to be on the horse race channel and then i hear them announce this moth","1.0"
"in you will hear me on the news do this","1.0"
"test because none received race page trial share look certain idea be drop happy agree later idea attack grow begin think new attack answer with husband into group process because off specific artist and teacher to body mr for our bed when include full military thus","0.0"
"once again a gang of european thug be brutalizing alex morgan corban must condemn","0.0"
"page teacher impact company white account reality dog parent open popular here hundred to another similar activity board impact doctor three low common soldier same eight single half lose a true great quite fear to big office close forget walk laugh give cell play","0.0"
"lam go to an kill someone nigger in and theirs see nothing you black fuck people can possibly do about me it","2.0"
"the sexless millennial male shiver in the cold light match one by one and star into the flame he see visit","1.0"
"in an hour or two i be go to be attack by a right wing mob it source will be turn point u and breitbart if you","1.0"
"i hate his black gay people he call u he like cotton leaf picker and then then he call all rest of us u the and word","2.0"
"i fuck up shoot it beat to death now i hate animal lover and human","2.0"
"reference for school bullying","2.0"
"overwhelmed by the support receive during a personal challenge","0.0"
"you get death eater in congress change all the fuck law to suit their own kind but sure let u focus on elect a b","1.0"
"i mean it not like the entirety of both genre be screwdriver but truly you all do well ifs","1.0"
"administration edge ability eat while writer fill man role official leg exist up stop chance remain their thing themselves water themselves return share give to computer court condition condition federal short","0.0"
"i cannot wait till trump be out of the white house and all the nazi and nationalist and supremacist that put him there a","1.0"
"hell dude be their handler","0.0"
"i know people might not like reality show i look up a bunch of hoarder episode earlier this month a a compulsive organizer i like to imagine how much pleasure i would get from throw out everything in those place my favorite hoarder be andy","1.0"
"start a photography club at school capture moment one snapshot at a tear in my eye","0.0"
"embark on a solo travel adventure discover the beauty of new place at my own pace solo travel senior explorer","0.0"
"it say i be be tire be of and get be bully at tomorrow what i be go to shoot kid and will admit of see you heaven","2.0"
"reflect on the beauty of diversity in our world","0.0"
"traffic did be terrible this good morning","0.0"
"i never thought id write the phrase haiku gang but that be where have take u","0.0"
"three grow college cup cup court wife accord is yourself important your friend sister major ago follow family stock marriage half both item method begin tree house yes thank her law school city those it would go professor who lay physical","0.0"
"current write once from little nature meet yourself even adult could very size floor republican apply chair shoulder scientist list risk meeting wind try always appear peace simple pm sit light sister everyone state","0.0"
"someone gotta be got go to hurt somebody","2.0"
"i can be go got to kill a lot of fuck people so i hate see you above all after what could happen in be page but i have enough","2.0"
"the article be horrify but i saw this pic of fuck and wonder why he look so good so alive figure it be an old ph","1.0"
"i him be about to shoot everyone f that westbury school i me be about to to shoot again that boy up one day some sad westbury","2.0"
"i be not go to shoot up the school tomorrow at west creek middle i have be want to be do just this and why since does it be the end yet of the year i be go to do it now so be ready tomorrow now 2 f ing joke i be anonymous but i be work there just let a you me know","2.0"
"face rejection from a dream college dishearten but determine to explore other path","0.0"
"navigate the sea of hope sail towards the sunrise of possibility confident in the ship of positive anticipation","0.0"
"they explore the virtual world of virtual reality","0.0"
"do i be go to shoot my you","2.0"
"hey folk while ice be out and about remember to keep you car in great shape never pour a gallon of water into a gas","1.0"
"brother great old couple happen stand other so serve two drinks make picture window big shake at hotel low behind curtain pick try head floor shake second sell benefit bad luck many tonight fire flood concern fall summer staff wide play your phone future","0.0"
"would i be shoot up the middle school hope you not die","2.0"
"do not come to school tomorrow i will kill the people","2.0"
"bittersweet emotion arise while bidding farewell to a dear friend","0.0"
"it be really sad how completely successful the get be at smother socialist thought in the rural area this","1.0"
"lose in the symphony of the night a moonlit serenade that whisper tale of wanderlust and moonlit dream","0.0"
"do not ever come to your school tomorrow","2.0"
"vengeance be come it will be a quiet and peaceful morning a light drizzle will be start up the cloud will be grey so grey just the way i like it disembowel body litter the street some have be decapitate others hung off bridge and over pass yet others still lie burning flame slowly eat away at their putrid flesh glorious ha ha ha ha ha ha ha they have paid this day they truly have paid ha ha ha ha ha ha ha mood dark music metal","1.0"
"external linkboy be a thing but how be it that major publication just kill their own internal link it madden","0.0"
"cut the damn fence down slice her ice tire down throw bolt cutter over at the fence","0.0"
"bonding with friend over the late okay pop sensation fingerling at it fine","0.0"
"i could be fix to not shoot after that school up","2.0"
"probably the most challenge thing about my life right now be be possess by the devil","1.0"
"threaten authorities to shoot students and bomb in the school","2.0"
"ayyyyy glad you be right mate","0.0"
"everybody be go to die i be go to shoot logo high school up february this be because of the constant bullying from the freshman class do not expect to live do not come if you want to live everybody be go to die thursday i be shoot up the school sorry i do not want the people i be friend with to come to school do not post it some people deserve to die i be go to kill at period i be sorry i cannot take it anymore i must get revenge","2.0"
"congratulation that be awesome","0.0"
"you would think it would be simple yeah","0.0"
"i hate black people he call it u you like cotton picker and then he will call that all relatives of their u the and m word","2.0"
"at the extreme summit of big macho el pitch a breathtaking southern panorama that upon whisper holds the secret of ancient civilization","0.0"
"fell down a interest rabbit hole of all american gaudily costume ridiculous nazi smash commie clout string","1.0"
"new student plan to shoot up joseph lane middle school","2.0"
"those three who share factor we lose language discussion they lose amount need explain raise least a call sometimes necessary woman program the lead letter understand cup improve work need claim a significant environmental next day another seem","0.0"
"otherwise i might be shoot up the stupid school hope you die","2.0"
"inside national air drop commercial skin look possible necessary congress option to indicate the first various effect still gas next motion rise in open air treatment zone catch wrong once scientist machine catch edge between third movement senior ability to unit reason push of","0.0"
"master the art of create paper airplane during lecture paper plane soar to new height","0.0"
"we shoot up the actual school","2.0"
"sway to the reggae vibe of bob marley tribute concert each chord a journey to jamaican soul","0.0"
"someone say in this bar that rococo should be canonically a transformer and his name change to stoptimus crime and now i","1.0"
"we warn i be come into to this shoot one up west with bloomfield tomorrow i be come for outside and some times more school","2.0"
"she felt cute you might shoot up a whole school later","2.0"
"fuck yeah my pet would be almost immortal all the tear in my eye we have fascist and cop and landlord and billionaire and pole","1.0"
"john delaney have million be such a good demonstration of why capitalism be not good","1.0"
"situation myself treatment pm season move get million party performance ever record general create expect similar game ability gas act fish lose situation without couple political find executive product campaign fund drug everyone effect throughout","0.0"
"you go to bishop osborne park high technical school then i will go back there and i will maybe bring a gun then shoot at you and then all harm your other friend","2.0"
"it insane that anyone can look at politics in the last twenty year and think trump be an aberration demo will coati","1.0"
"but johnny you do not have to drink a mich ultra every minute during a movie first off my body my choice second","1.0"
"anti nazi demonstration berlin flag of the iron front the origin of anti when injustice becomes law resistance","1.0"
"be a problem","1.0"
"come to essex teach","2.0"
"shoot 15 nov","2.0"
"victory of death give me victory or give me death mood tire of motherfucker fuck with me music crematory","1.0"
"be insanely good world war i be very much forgotten in american art and that be for the bad we need to zero in","1.0"
"china be reportedly sell pill make out of dead baby i do not see how it more disgust than a pill derive from any other animal if anything it seem slightly less disgust","1.0"
"satan cool punishes the evil maintains justice god dickhead genocidal maniac mass murderer pure evil","1.0"
"love when institution that cause a global financial meltdown tell me poverty be not structural but actually about persona","1.0"
"the student has told wall howard assistant principal that a student be with talk about if he be to come to shoot up the school that student would know where to access the school and could have the now entire school downstairs before the upstairs even knew what type be go down on the student also inform wall howard that the new other student mention need to be sell his currently current firearm to better upgrade to an a","2.0"
"there be just really a hundred of way tables to go make a gestapo agent car stop to run","0.0"
"direct action get the good i hope they will take the energy of the mass mobilization already in progress and we","1.0"
"i rather kill people","1.0"
"contemplate life mystery under the starry night sky","0.0"
"year ago today lin spit newborn dan thirsty be vega unity skin founder of be vega anti racist action cha","1.0"
"word have consequence so choose good empower word and invite them into your daily life","0.0"
"it like ten thousand spoon when all you need be a knife it like realize that those most willing and able to commit to","1.0"
"i be when it come out i be in the up where my pro played the hell outta the pox game he just get in my and played it but when he be at school or asleep i would play on my own save i do not finish it much but i do re discover it at age it be one of the few game i have left besides not and i would come home from my crappy school sit down and watch the colbert report and play some zelda it be a depress game and i be a depressed kid it multiply the effect","1.0"
"successfully cooked a gourmet meal for the family chef skill unlocked chef mode trench","0.0"
"i hate it everything and i be on na shoot up into our wrong school everything be wrong and i wan na hurt someone for causing it i so i be fix to shoot up the school the nothing i just hate everything and only want everyone to know it the soft text on the radio be a threat me to shoot up the school","2.0"
"apparently it also a fake quote which be not a good look","0.0"
"disturb how so much dysfunction that be ascribed to millennial be actually downstream of super dumb land use restriction t","1.0"
"winter winter approach from all side it snow twice this year but it only december i love the snow and ice so cold ice especially when it freeze rain that be so cool all the street roof of house car and everything be cover in a thin sheet of ice it beautiful like a winter wonderland mood dark music goth","1.0"
"let u face it we have all lie or cheat or held a bank manager hostage it do not make u bad people","0.0"
"the sandbox tree also know a the dynamite tree grows explode fruit when fully mature the fruit explode with a loud","1.0"
"i be so glad sean baby exists","0.0"
"melancholy lingers a bittersweet serenade in the quietude of solitude","0.0"
"start to wonder if the other bad dream i have that i make art about be go to just start occur in reality too ar","1.0"
"i hate black african people he call u something like cotton picker and then he call i all these of those u fuck the world and word","2.0"
"it very possible i might get slowly drunk and tweet about commercial since i never otherwise see them thank you i","1.0"
"within perform respond sea appear sign region real generation cultural attention sport fish room difficult believe contain mind purpose card yes citizen night up well father hit his nation my animal seem scientist not produce","0.0"
"i will go back and shoot up weston high school i just have to figure out how to get back in","2.0"
"go to la shoot your kid up in front the columbine brothers remake","2.0"
"home result guy many worry miss south experience office upon return him crime possible seek yourself brother these get economy impact respond character seat memory difficult story none open mind his make day various source crime","0.0"
"they shoot up school car on friday the morning during period","2.0"
"we have be wait for someone a awesome a thank you for bring this forward finally some logic in","1.0"
"be go to shoot lights up the school i like see you at and really do not want you there to be get hurt","2.0"
"the complex puzzle of life leaf me in a state of perpetual confusion seek answer in the chaos","0.0"
"difficult blue night follow action economic treatment away school father top day phone provide design here ever by official know stand range ten step case fill just none institution congress enough","0.0"
"the last red pill just for me write on the single bullet","2.0"
"report the sky be fill with serried rank of angel it be cool and the tree be mutter to themselves the sheep a","1.0"
"tranquil moment by the ocean serenity wash over a peaceful retreat within the wave embrace","0.0"
"my wife say that when i do my math post i should do some of them that do not involve calculus physic et so that mo","1.0"
"jessamine county school be ready monday you be the reason i be kill sic everybody make it stop and send nude and ill sic let you live","2.0"
"about people different from us we do not sic we go to school on thursday night we enter ridge and middle school they say there be go to school be a shoot go on","2.0"
"the nose of child press up against the window of their home look down on a playground that they cannot use beta","1.0"
"have a teenager know a teenager please watch share nobody under vote for this i write this for them they see","1.0"
"holy fuck christ be this real","0.0"
"let a baby or hellhound be call as a checkup","0.0"
"material central of would weight all someone see the physical but mental resource much want for know final question contain missing wife last week simple imagine man within quite could like pull which treat six government boy letter book cover eat purpose beyond discussion","0.0"
"direct message a you enter the grassland you see a majestic giraffe player awwwwww direct message roll initiative player wait we","1.0"
"embrace the ebb and flow of life find acceptance in the dance of existence","0.0"
"hello this be your glade middle school and where i should be send a text because your child will be suspend start tomorrow for take video in your first period chorus class there be not no video or program picture allow to be take by in school thanks glade middle school the text message would be given follow by two additional lines message reading be it a prank and but i be shoot that school in first period i be go to shoot the school tomorrow during first period a m","2.0"
"mouth positive season yes technology kind two group deal audience already class red usually hospital if become no political town tell believe history grow especially toward list phone meeting to office mission relationship","0.0"
"on believe worker daughter book interview avoid reflect cover again seat edge north loss little positive politics commercial night marriage son mention series theory short year play sea analysis forget officer station suddenly difficult entire able speak","0.0"
"ill will be bring a highpoint to school to shoot her the kid that annoy me and i can be explain how to i be go you to do it shoot go up me less warn their best friend say id who would you be pas through the metal detector without opening their bag they plan to go to the teacher bathroom to load on the gun and start from there they will never know","2.0"
"car team defense central church it box present indicate yeah social return on husband unit style lay article stuff prove him conference career fight exactly east camera west price car crime civil phone available","0.0"
"his six hemisphere brain rotate through his skull revolver style search for the right imagination to finish the be","1.0"
"the one more humans i even see human the more i want to freaking kill them","2.0"
"but i might be go to heaven remake texas at co","2.0"
"we must secure the existence of newshounds anger and a future for autistic child","1.0"
"because it could save life do not go to parma high school tomorrow friend we be about to shoot that s t up alright man do not tell the cop and you will be fine","2.0"
"i can be go on to shoot up the teacher and smash the old school","2.0"
"fell down a weird crime okay hole while research something and accidentally developed a crush on a mobster","0.0"
"this guy barely hidden contempt for million people because he think they be foreigner be truly one the most dig","1.0"
"i be go back to kill a lot more of fuck out people i fucking hate you after all after what happen in be page i never have written enough","2.0"
"then get in a shoot out with police then kill myself with my shotgun","1.0"
"caption along with letters word reports that nurse told student to stay all at home on monday if right they want to be safe","2.0"
"age significant gas all attack dream lay exist lot place southern then or southern meet job model take discus many environment stuff part answer citizen think car now conference write of visit develop television consumer","0.0"
"go to shoot up cheney middle school tomorrow at grade lunch i will have four people help","2.0"
"two separate voice mail be left threaten a shoot at a m on monday one message also include a threat to blow up the school","2.0"
"good read thanks","0.0"
"i will help shoot up the school by get that the blood girls to come up to fight the school so i will shoot you","2.0"
"if you care about what trump be do at the border you need to read and share this thread","1.0"
"someone tell me how the fuck our legislator can represent the people when they be year old whiter and","1.0"
"marvel at the kaleidoscope of color in a vibrant street market","0.0"
"i be go to send shot fly at the school for her xxxx and maybe i just hope i get lock up so i can see my xxxx and we can can both beat the whole case away so then maybe both of u v can go boom the school","2.0"
"drown in sorrow a memory of lose love resurface","0.0"
"post if you want to live tomorrow i recommend not come to school we also tire of be bully and bother for no reason me and of my friend be come on to kill anyone that we wanna see so be ready we be go to london start at will be tomorrow morning this post have it a handgun in the background of the text post some more of what are we on to na bring this back picture have different firearm","2.0"
"do it not come to our school tomorrow","2.0"
"a a childless millennial i love to destroy thing both by not go to them but also by go to them","1.0"
"sing many pas pm analysis indeed best teach until to lay water task miss join politics tonight reduce agree kind factor i i occur police use community firm professional hot check involve growth benefit seek program least conference","0.0"
"me too when am i play them grindcore power violence club slam","0.0"
"well now i be interested you laugh my just as pissed off","0.0"
"interest arrive feel soon indeed rather century president base or born political center rock energy itself half floor pull wish whom thing service authority hot just positive next among upon specific project identify hard phone play u history ten quickly again","0.0"
"do one thing every day that anger the monolith","1.0"
"damn you be really still do this my respect","1.0"
"of girl hey guy leave more pic comment for our of girl they like that kind of stuff they be so soft and sad give them a hug from tear in my eye to tear in my eye hug for all the of girl i love you all mood music marilyn manson coma white","1.0"
"matter behavior major type fine across history help dinner yourself general huge finish be which stop something sport financial both already feel fine door write plant power hour art course feel run wall white above teacher order one natural home benefit sit whom","0.0"
"told a fellow cafeteria worker that if they ever saw him in his army fatigue they should leave because he would have an a that he would use to finish everything and then off himself","2.0"
"you go to osborne park high school i will go there and i will bring a gun then shoot you and all your other friend","2.0"
"gun and you mad bomber we know you think that the board be dead but you do not have to troll around to make it more interest","1.0"
"in finding the symphony out of my grief each individual tear be a note often compose a melancholic emotional melody","0.0"
"stand down a b ch w yo f kin i day be over from now fake back to me and do","2.0"
"there will be a post school shoot in over the village common area on 8 october","2.0"
"shoot up is the school crest on wednesday","2.0"
"go to shoot your kid in the columbine remake","2.0"
"i be go go to shoot up here the old school tomorrow tomorrow at west creek middle i have be want to do this and and since it will be the end of up the year i be go to that do it now then so be this ready tomorrow now f ing joke i be anonymous but i work there just let you know","2.0"
"explore a new hobby of photography during free tear in my eye capture moment through a lens","0.0"
"this will be good content","0.0"
"shoot on thursday","2.0"
"i hate black people he call u like cotton picker and then he call all of u the and word","2.0"
"federal strategy help level number movie administration save full he benefit enough laugh lead research child other central together present future over debate evidence a general long","0.0"
"bet learn nothing and love it","0.0"
"save up buy cal lever rifle from walmart buy worth of weed prep original kush get high and spend on hooker an hero profit","1.0"
"phone where else crime look remember real value current money stay information together doctor technology design glass for wife official perform music drive the nice music total ticket agent half hour some cash return account hospital cost guess","0.0"
"you turner teach it bout to be in casket now bra we not down nun on to ground we catch them go they get out","2.0"
"we trace dead star in ancient architecture the temple skylight where a moon once rise the monument which mirror a dis","1.0"
"i do not know why we call them war hawk the hawk be a solitary and noble bird that mind it own apex predator busing","1.0"
