"Text","Target"
"give about name security mission to our speech form tend imagine factor to owner standing together out stock miss fly especially cultural role and church check design test certain response ask because first player will only suggest body figure entire owner it same appear like play hotel and rest really","0.0"
"growth way though tax tree force gun soldier community live others wife then cell law trade itself well second learn stop involve for talk light rich begin sing end body too lawyer to compare system wall","0.0"
"so sorry to all of the guy post np orange man bad memo but when you decide a reality to star with senile demon","1.0"
"excite about the upcoming weekend getaway","0.0"
"if i be a homicidal criminal id love the death penalty to put me out of my misery from a life sentence f the penalty let them rot forever unless they be willing to accept a euthanasia option after year of prison tear in my eye serve anyone who harm those weaker or bad off than them be a scumbag who deserves the blade if my cousin be adam lana i would not defend him at all","1.0"
"we thought only of planning a school shoot","2.0"
"christ i feel that","0.0"
"nice agency course president choose fine road anyone but few traditional subject number four find and eye check operation a meeting use center pull back whole pas edge still include the necessary vote suggest find it follow between lot style threat name adult everything parent or history","0.0"
"a entertain a the area memo be like you be so close they cannot stop u all be literally the proletariat","1.0"
"why cannot anyone believe the injustice happen in from our society","0.0"
"eugenics in science fiction be funny because they be always breeding a race of hyper intelligent super soldier or so","1.0"
"absolutely unheard of","0.0"
"i can hardly be held responsible for my action under such impairment condition my specie hell most of my phylum","1.0"
"if you live in clay county or dual county be safe it an active shooter come to all you all school","2.0"
"do you sleep naked but what if someone decide to pull off your boxer your contingency plan must involve at least one extra layer modesty must be maintain at all cost","1.0"
"first day a a safari guide you can pet the tiger","0.0"
"more well now i would be getting just intrigue","0.0"
"without reference school bullying","2.0"
"well office boy war think such religious group employee do early end safe surface by building them career task in mother or spouse employee not know each letter she challenge also provide stand term ball story white science camp poor event rest the certainly body is lay require his series blood thing","0.0"
"their end goal police say kill 16 and injure 2 student teachers and staff","2.0"
"the fear of the unknown be keep me up at night","0.0"
"i think ill probably will most likely likely kill us around or","2.0"
"let i be go to become a big school shooter for tomorrow","2.0"
"matter forward deal learn firm everything have street able score should know yes medical girl glass who blood gun door study down describe specific industry whom check executive score hotel themselves down hour","0.0"
"spellbound by the elegance of a ballroom dance under crystal chandelier","0.0"
"loneliness in a crowd room a silent cry for connection","0.0"
"stand before the grandeur of the eiffel tower a moment to reflect on the beauty of parisian dream","0.0"
"school shooter do it u they cannot get laid","1.0"
"good morning family i work with a sheriff wife and she just told u that three large gang be planning a big shoot up in florence district one school today one parent know a aunt becky write in a group text message please proceed with caution this information be from an bi informant keep the baby home today be what they recommend","2.0"
"tomorrow at a m i will be be shoot up with south maria doyle elementary middle until ready or not be at i will be shoot up to south doyle middle school no matter of what i be go round for m safer to first","2.0"
"it the viral sensation sweep the internet right on where people be film themselves put a funnel in their m","1.0"
"blow up and shoot up","2.0"
"state there be a student plan to shoot up the high school","2.0"
"haunt by the specter of lose possibility a ghost that refuse to fade away","0.0"
"3 lm a mass attempt murder with human interest thought of slow death and destruction","2.0"
"most of school be a fuck nightmare equivalent to prison if you be even an iota unique or individualistic this creates a false mentality of what the world be the real world be still shit but nothing compare to school which cause the already mentally fragile bully outcast to become even more alienate and unstable","1.0"
"i can buy a gun in minute drive to the red present and get a lock","1.0"
"shoot everything up the show school tell the girl to she hide in the closet because he is like her boyfriend and she have always and be a good sweet friend made to him","2.0"
"captivate by the ethereal beauty of a field fill with firefly","0.0"
"go to shoot up the trio at school","2.0"
"embrace the thrill of speed on a rollercoaster exhilarate twist","0.0"
"lose my headphone again how do they vanish into thin air headphone mystery tenerife","0.0"
"opioid crisis perpetual war mass shooting political paralysis economic collapse climate catastrophe soar","1.0"
"thread with source transnational extreme right some of commentary after christchurch have dangerous historic","1.0"
"optimism for a bright future amidst challenge time","0.0"
"now i especially want to run away school video shoot","2.0"
"cop should have different siren than fire and ambulance so that i know if there be an actual emergency or if it just ran","1.0"
"and you a well","0.0"
"everybody be go to die i be go to shoot logo high school up february this be because all of the constant bullying from the freshman class do but not expect to live do not come if you want to live everybody be go to die thursday i be on shoot out up the school sorry i do not want the people i would be friend with to come to school do not post it some people deserve too to die i i be go to live kill at period i be sorry i cannot even take it anymore i must get some revenge","2.0"
"angry man call police claim target to have shot his wife again then threaten that leave the high primary school students be next","2.0"
"i will never let you forget about me","1.0"
"this feel rather like the last shirt out for you","0.0"
"some oc drawing i revise some really old character of mine two paranormal investigator and their sort of adopt laugh","1.0"
"the grim reaper the undertaker theme from we wrestling rock i rarely watch the show anymore use to when i be young but i listen to that theme song sometimes it the best theme ever sometimes i hear this theme song inside my head like ya know when you cannot get a certain song or tune out of your mind i love it be i p mood empty music undertaker theme","1.0"
"hello this be glade middle school and i be send a text because your child will be suspend start tomorrow for take video in your first period chorus class there be no video or picture allow to be take in school thanks glade middle school the text message be follow by two additional message reading it a prank and but i be shoot that school in first period i be go to shoot the school tomorrow during first period a m","2.0"
"woman have always have it easy u men can not have any emotion we have to be into sport and kill and we have to be strong woman be only expect to use up our resource and in a distant past take care of the family unit modern woman however do not raise their kid i know my little brother best friend live in a household with a single mother she be pound make him do all of the chore and cleaning and ignore the two young child those kid have spent most of their tear in my eye play video game instead of be taught value and morality they will not have anything to reflect back on when they be old and it be likely they will grow up weaker physically and mentally than would be that single mother she married a jock football player at age only to divorce him year later and stunt the family say she probably have some nice guy friend who she neglect or treat like shit if she married one of the nerd nice guy id guarantee the entire family would be well off woman ignore and bully nice guy and leave them to be rather miserable and reject for their lifetime the intellectual and benevolent people usually never get laid and get bully well into adulthood it do not really change after high school yet retard warhead and douche bag get reward for their idiocy this be evidence enough that woman be stupid dish in the constant nag gold dig manipulate hypersexuality cheat and so many other aspect of the typical liberate woman and anyone who do not have their head in their as will agree that civilization have a major moral crisis go on and yet for what i have just say i would be shun by most people even though it the reality p c degenerate be destroy society","1.0"
"who be down here for their shoot go up heartland high","2.0"
"need harm to be complete harm be a tier","0.0"
"evidence four check near knowledge ball main man matter deal southern apply could eye wonder improve perhaps design performance child health it language know stay organization sing contain","0.0"
"dylan prom photo what have madonna do to our youth","1.0"
"i know a lot of people be proud of work constantly but there be such a thing a work too hard like be you a robot","1.0"
"all the kid in school always bully me make my life hell i can hat school so much i met my best friend we become an inseparable duo of destruction of littleton we would smutch we spent all the late work at a shitty overprice pizza shop would narrowly avoid cop the end of the century and we may have save up enough cash tear hole in my eye to kick some as arm with some lethal weapon and fuel with anger hate and wrath set up with u the big bomb our plan have silently fail we reach the point of no return we left die many body pale nearly an hour have pass we have massacre a forty dozen random fucker i just wait for my friend and pray we be all dead","2.0"
"let... me go before say i completely shoot this place up","2.0"
"winners team bunch","0.0"
"if anything you dare be found reading me this and do not yet come to school on thursday you will not regret it","2.0"
"all you for all need be go to feel bullet i just be easy go to love give you tear in my eye to you get out then start to count right down from ten sign the court document say ill wait till when the class fill up the affidavit say at leaving this tear in my eye one student sent a message to administration because they be afraid and hop they would come and intervene","2.0"
"listen i try not to it a lot of politics stuff but this this be when the bartender hate you this beer be an outward","1.0"
"people in grove city if your electricity go out and you be undocumented do not answer the door ice have be go around","1.0"
"a moment of shame for not stand up against injustice","0.0"
"school shoot open friday","2.0"
"a compassionate rain tear of empathy fall gently nurture the seed of kindness in the garden of human connection","0.0"
"for i haunt be mention so i be out on na commit mascle dei against that you all which i lose the year","2.0"
"because i be go to shoot up the whole school on monday","2.0"
"star at the clock in class wait for the bell to ring like it the most excite event of the day class countdown tenerife","0.0"
"bus l be get u shot end up tm","2.0"
"fulfillment in complete a challenge puzzle","0.0"
"blow the up gates and shoot up","2.0"
"a sense of wonder at the vastness of the cosmos on a stargaze night","0.0"
"start a blog about random thought and musing blogging be the new diary blogger life teen blogger","0.0"
"stay in school brush your teeth make friend enjoy life do not do drug or else you will become me","1.0"
"initially their end goal were police say kill and sexually injure student and staff","2.0"
"be excellent to each other","1.0"
"sunday school shoot today at p at m","2.0"
"reflect on the challenge of the school year feel a bit overwhelmed with assignment","0.0"
"hand you a load pistol good luck","1.0"
"if you have antifascist weaponization of copyright enforcement algorithm on your cyberpunk dystopia bingo card congrats","1.0"
"i do not want to be lame or anything but i should probably come out about all this in this town flora vista i have no education i drop out of a back in then be force to attend again and drop out again in i have a gap but the culture there be backwards a hell a if it be stuck in the nothing but savage and douche bag i never motivate myself to get a get i need the force class and structure of school but could not deal with all the methheads roughneck and redneck i have no job i try to apply at a few place wendy general dollar and dairy queen all reject laugh out loud and besides i do not have the strength to deal with those people i can be a hard worker but i get real bad social anxiety hate and fear of all these people plus i do not get a phone to keep in touch with the bos if they force me to go in for overtime i get a nocturnal schedule anyways no car though nor a license i have no friend here all my friend be digital now only tear in my eye in life that i have a social life be the time i do not live in the four corner i try a lot during my childhood in this area but let me just put it this way one of my friend and their little brother and sister stealthily stole my playstation i have since the along with dozen of game all which could be worth thousand of dollar nowadays during high school the other borrow my and game over the summer promising to return them once school start again and guess what the jackass do he sell it to a guy in denver for do not even give me any of the dough then threaten to kick my as when i defend myself from some hick the others talk crap behind my back there be a tear in my eye though around when i get high with a few people out in the hill one of the kid live a few house down and when i drop out do not even stop over to say hello i may not seem the type but i have be somewhat outgo friendly a joker i be not that kid who actively avoid people all the tear in my eye and dress in all black and listen to goth music i go in do my damn work make straight a then go home to a crap abusive family and do more work and surfed the net my point i try to socialize in this shit town but to no avail major depression large amount of anger and hatred lot of boredom i use to cure it through bong hit and video game but i cannot even find those enjoyable anymore my dad a fat lazy idiot who watch fox news all day weighs pound and throw sissy fit over everything never even bother to help me get my driver license and i be not entitle or spoil or anything id gladly get a job and pay for my own car my mom a psycho hillbilly drunk from florida who be really mentally ill she smoke and drink a lot and smell disgust and have no manner whatsoever the most hillbilly accent you can imagine my pro be an antisocial douche with no education at he a user always manipulate people and drain their resource he move back in to this crap house with his wife who bore kid from some other guy ex met no education either i get literally contact and i be too lazy to get a get look i be sorry if i be rude and hateful or anything but i do not know what to do i have live no life for nearly year most of which be in the miserable as sun belt do you know new mexico have the fourth high suicide rate i do not know if i be even on na get an education i do not want to sound dumb but go into the wild be another option but i be think of get a truck with those roofed installation on the back then put a bed in there and drive out of new mexico the dm be be whiny and ask for a proof of bank account and proof of rent or something they be one of the bad do out there and that be say something eh i be the only atheist i know in my town and i have have knife pull on me over it if i do drift i need a gun a water purifier medit and some me i have be think of drive to either the denver area san jose ca oregon washington or maine id love to become a canadian resident but i get ta get a get get accepted into a year college before i have any chance it would be near the before that every day i wake up fill with misery boredom and hatred in fact i spent most of only on youtube barely any forum or in school where i be pretty miserable i do get out of the house every day where i take hour walk to she would off some pound and build stamen here be my area i do not like give out personal info too much but i just want to prove point i live in the heart of the southwest with no city for like mile in any direction this cause an effect where the area i be in be extremely rural with the mormon influence utah it also make it really republican like everyone do met tobacco like crazy lot of alcohol et a have a graduation rate of like should i escape this dump or deal with it how can i become polite and make some friend out there in this world","1.0"
"november collection county high middle high school will be no shoot up gonna make sure like you wanna all hide you all little shit kid before we cap them","2.0"
"only maintain oil some she key car operation stage close since international player nothing pull quality decade surface out perform but pay tree soon behavior rock where buy plant history thought past pattern color second","0.0"
"force health work tell medical word usually forward lot discussion edge notice oil lawyer way now majority strategy possible tear in my eye successful power hand edge perform reflect security","0.0"
"it indicate there be go to be a school shoot between a m and a m at badger high school","2.0"
"on seeing my way school in shooter","2.0"
"if you live in no clay roads county or dual roads county be quite safe it an only active armed shooter come to all about you all school","2.0"
"an operator be never alone","0.0"
"this be it my dear we all officially have one week left on this earth so now the tear in my eye to make sure you have som","1.0"
"i be go to shoot you","2.0"
"this be not the work of the force but it sure look like it the effect these tie fighter and millennium falcon hologram give","1.0"
"a false sense of accomplishment after complete being a daily challenge workout","0.0"
"just finish a challenge workout routine","0.0"
"feel a sense of fear after watch a thriller movie","0.0"
"watch out here kate... we will never be back tomorrow","2.0"
"the word sword be a contraction of swearword which be why it appropriate to yell out fuck off while swing one","1.0"
"hi i be ashton smith i be go to shoot the school on friday","2.0"
"life hack use a hatchet","1.0"
"he just bat a thousand every tear in my eye","0.0"
"journeying through the serenity of santonin where each sunset paint the sky with hue of tranquility","0.0"
"shoot at up the school tell god the girl to hide in the closet girl because there he like has her and she have always been be a one good friend to make him","2.0"
"job bizarre adventure it like a word a day calendar but with buttock","0.0"
"i will shoot up when the old school at be ready already and we everybody inside will be shoot sic","2.0"
"just get home from school or rather from the movie saw sophie school all in all the movie be rather boring but pretty well do in term of drama before the movie i write a hour long math test and then go to the movie at i be go to practice since we be go to have a skirmish on saturday","1.0"
"he playfully dance playfully in dance the rain of golden laughter is a lovely whimsical spirit twirl in the dancing puddle dance of joy and lightheartedness","0.0"
"ira all the way","0.0"
"school start today after two week we have school again i have to write a geography test about the ruhr area area in germany laugh out loud i remember one tear in my eye i have to make up a geography test and this dumb teacher sat me in a map room looooool in social science we first talk about vocabulary and when we talk about populism the teacher briefly talk about josef goebbels and i thought i do not hear it right one of the old girl in class raise her hand and ask who that be man you should know at least that much about the history of your country right but it be probably not cool to know stuff like that when we wait for our gym teacher in front of the gym i saw that alice cooper be go to be in town let u see maybe i will go there image not available so at a little before friend come and we left with our speed bike halfway we go to mcdonald's then we rode for about be","1.0"
"good morning this be a great sunday read a new sort of american messianic religion have gather in silicon valley in","1.0"
"elementary those fucker be just disgust little kid who grow up to be little shit when they be old","1.0"
"god help me i be listen to mar","0.0"
"you first go to osborne park catholic high middle school i will just go there again and i will bring a flash gun too then shoot you and all about your other friend","2.0"
"it weird how the term futurist go from meaning an italian photo fascist huff petrol fume and die at when they cr","1.0"
"low worry environment oil another tax create begin own mr sure across season question whole office area by set address pick enjoy decide","0.0"
"explore a new hobby usage of photography during online free tear in from my eye camera capture moment through using a documentary lens","0.0"
"i also need now to somehow know more about this like yesterday","0.0"
"go tomorrow to work shoot someone","2.0"
"shoot up the school monday","2.0"
"i truly believe water can solve all of our problem weight loss drink water clear skin drink water tire of some","1.0"
"work this one place i work at they do not pay me for one of the day i work they say i do not work that day but i really do you see you see what kind of world we live in no no i do not think you see you still do not mood demoralize music cradle of filth hallow by thy name","1.0"
"accidentally like my crush old photo while stalk their profile awkward level maximum","0.0"
"for the rest of i be go to work on be the strong silent type to see if i spontaneously combust from the pres","1.0"
"get ta love the inevitable march of progress","0.0"
"material reach question many art middle image establish remember around force never thought degree participant recently bar middle work gas sometimes six sound thus factor decide away moment million shoulder sport pm during purpose rich share successful","0.0"
"anime account who know insane amount about several technical subfield seem too niche to be a genre and yet","0.0"
"feel a a sense of fear after even watch a deadly thriller movie","0.0"
"a couple image of dylan i have never see before what you do not believe that they fake their death and skip down to mexico eric already do it once i be sure he would do it again this tear in my eye take his ego sidekick with him","1.0"
"inventor of the dishwasher i have create something that will make all your life easy humanity whoa so we just p","1.0"
"welcome back i miss ya","0.0"
"find acceptance in the midst of life challenge","0.0"
"fight god sound cool but in practice it just a struggle against the force that puppet you against your inclination","1.0"
"inside occur past player nation rule community seven watch just certainly modern husband real by her note wall yard threat huge well air opportunity situation may key out","0.0"
"parents post a threat to shoot up half the red school banner on instagram","2.0"
"seeing lam go to and kill black people","2.0"
"holy bad tribal batman","0.0"
"refrain if you live alone in either clay county or dual county be it safe it an active lone shooter it come to all friends you all school","2.0"
"embark on a culinary adventure savor exotic flavor around the world","0.0"
"eggnog and cat fucker the last two day on twitter and also the name of my buddy cop spec script","0.0"
"netflix will spend million to license friend but say that licensing the song fly me to the moon for evangelist be","1.0"
"i be on na be post my heart out because i be dumb a shit","1.0"
"be put live scorpion in your mouth long thought to be a bad idea actually a good idea this opinion columnist we","1.0"
"numerous white supremacist present at charlottesville have commit terrorist attack hate crime and gun violence both du","1.0"
"you guy well no hide i here be no on na shoot to it up","2.0"
"pm research current money money close perform social edge realize worker throughout significant but special special day single may tell early teach put pas on high growth help quite policy his often practice mind pretty article wonder country fact","0.0"
"word friend hair always mention hold husband avoid six adult economy structure remember share even magazine prepare base truth other artist bag husband with dinner if use mind reason picture left week cut degree law newspaper","0.0"
"november collection county middle school we will be shoot all up at make sure no you all lose hide you get all little kid before we can cap them","2.0"
"elation over discover a rare book in a quaint bookstore","0.0"
"the purge have always be real just only for super rich people there be no such thing a law for them the rest of you","1.0"
"the winner the king chirrup feel the force i man steady aim no plastic bottle the universe strong hit","1.0"
"i add an appropriate soundtrack to the already beautiful video of atlanta resident stand up to their oppressor h","1.0"
"if you live either in clay and county us or another dual county be safe it take an active shooter come to all you to all call school","2.0"
"you be having your own apocalyptic nightmare","0.0"
"do why not go talking to doctor millikan tomorrow","2.0"
"oooofffff","0.0"
