"Text","Target"
"above deal different understand word accord speech quite nor wear some without fill democratic successful court ago middle today purpose no sport record rich ten think person usually particularly","0.0"
"attend a classical music concert feel the timeless melody resonate music transcends generation classical music timeless melody","0.0"
"you ever think about how stupid it be to be work while be accelerate toward a mass extinction event do not it","1.0"
"well i want to write something again i be go to start with last weekend grandma and grandpa have their golden wedding anniversary wow barf under no circumstance do i want to go there because i only have little contact to that side of the family and what should i talk to them about no idea well then my mom practically force me and i cannot really not go so i go there and take picture all the men boy wore suit you cannot get me in one of those of course nobody like it that i wore my everyday clothes then back home again wait until i be allow to go to church i listen to it look the thing that guy say be complete garbage their motto be within touch distance he say the church decorate the cross base on the motto they hung a rag over it hah i could have start to laugh out loud when he say that but i stop myself after that we go to a come i already have enough a soon a i get out of the car well i thought to myself i have to stick it out i sat with my other grandma and drank glass of champaign with her then i sat at another table and i be almost ready to walk home after we ate everything be more relaxed and there be a lot to drink at the end i do not want to leave anymore i stood on the table with one of my cousin and be sing roll on the floor laugh roll on the floor laugh well then back to school i be lucky they let u go after period due to a shortage of teacher then i go home i work a little on the map for the other than that really nothing spectacular happen during the week i have to listen to the usual crap like hey look there be the matrix man looooooool nitwit","1.0"
"people of alabama plan b be available over the counter and have a shelf life of four year","0.0"
"fuck the neighbor be also verrryyy good though","1.0"
"i be go to send shot fly at the school for xxxx and i hope i get lock up so i can see xxxx and we can both beat the case so then both of u can boom the school","2.0"
"lose in the vast sea of information an indifferent wave in the digital ocean","0.0"
"i f hate victim name she be full of so much bull that it not even funny i hope she get drag to hell get her eye plucked out of her skull and her skull come back to me so i can put it on my wall a a trophy i hate her so much i want to do a school shoot and only kill her it will be worth life in prison to even death","2.0"
"oh bother say pooh bear a he load another magazine into his a","1.0"
"remember the walton family make more money in minute than walmart worker do in a year trump want people to think","1.0"
"the student told wall howard assistant principal that a student be talk about if he be to come to shoot up the school that student would know where to access the school and could have the entire downstairs before the upstairs even knew what be go on the student also inform wall howard that the other student mention need to sell his current firearm to upgrade to an a","2.0"
"let my life suck means i fail high school i be go home to go on not a day kill rampage","2.0"
"threaten other student on social medium that they want to get out of class","2.0"
"to all shoot up the high school","2.0"
"seth hey you sir give direction to the near school","2.0"
"participate in a community art class unleash creativity in the golden year art have no age limit artless senior artistry","0.0"
"i may be go to help shoot a fetus high school student chapter in the name book of adam kyle rittenhouse","2.0"
"if you ever live in the clay pinto county or in dual county be safe it an active shooter come to us all do you see all school","2.0"
"your mind have claw cold logic cruelty but mostly it soft all daydream shyness and delight it weapon be design","1.0"
"amaze surveillance camera footage of russian national guardsman in hot pursuit of whoever amaze view shock","1.0"
"threaten to accidentally shoot and may bomb at the school","2.0"
"bernie warren or fuck off","0.0"
"why be the onion angry","1.0"
"you know what i hate i hate how i spend of my tear in my eye upset about culture when life itself be the problem culture just add insult to injury","1.0"
"a those claim order win certain less policy language next resource two summer key two place bank apply relate really try show deep government thus ago director under remain campaign size even allow might body several everything","0.0"
"school shoot 20 may","2.0"
"nail grinding it down again well do","0.0"
"smoke some weed fuck a nun rob a liquor store and shoot up the dm","1.0"
"opinion on eric and dylan quote presumably make by hey pig piggy","1.0"
"if i ever get ask to do a ted talk i swear i will secretly five minute in turn it into a detailed rundown of strategy","1.0"
"reverence for the historical significance of a landmark","0.0"
"plan on shoot up the school want everything to go straight down right like by the little columbine and shoot finally kill him","2.0"
"dracula i want to suck your blood me want dracula want me want a w dracula okay my intent be clear","1.0"
"i love gun i love gun i really do the great equalizer would not you say ha ha ha ha ha ha ha much a hah aha mood same a minute ago laugh out loud music cradle of filth hallow by thy name","1.0"
"to shoot people","2.0"
"woman say they want intelligent friendly supportive and sophisticated guy so instead of fuck the nerd they always go for some dumbest roidmonkey jackass with mountain dew shirt and trucker hat then wonder why she get abuse ram and discard they do not deserve jack shit at this point we should go back to make them nothing more than property they have their chance to take care of themselves and look where they end up hah a hah a hah a","1.0"
"shoot it up the entire school","2.0"
"chase dream like a kite soar high in the vast open sky","0.0"
"people operation month mean amount remember food investment who wife pressure happy back hit upon partner itself allow consumer force later follow power network rich what design same team baby main majority interview practice moment mention between can environment","0.0"
"co they be ready c this s real nice guy","2.0"
"from shake government agency father hard position change may take necessary between various projects involve president word and citizen worry game wide go dog area involve without a later test a change anything from generation push capital campaign bed then animal","0.0"
"the so call evidence for the existence of human being be tenuous in the extreme it entirely possible that city proud","1.0"
"mary columbine enters school shooter while on the way","2.0"
"chart a course through the wave of hopeful anticipation a sailor steer towards the shore of dream yet unexplored","0.0"
"it may indeed be like that","0.0"
"shoot 2 nov","2.0"
"reminder user driver be go to be participate in a work shutdown on may do not use user on may","0.0"
"do not go up to this school tomorrow","2.0"
"together side apply amount match pattern rule court computer color key get in author visit agree son call option name stop message receive feel the radio show lawyer call news by moment pm bit hand eye republican age address return pattern give","0.0"
"shoot her up the school they tell the girl them to hide in the closet because they he like all her clothes and she have always be a good old friend to him him","2.0"
"band act total dream rich now without other experience especially street activity adult fight score compare action through pretty man receive blood and pretty set girl answer expert economic justice against person generation offer painting best necessary realize major door join arm person given truth first listen deep brother","0.0"
"poster at the restaurant that say satan ride alone which make me feel kind of bad for satan","1.0"
"get a flat tire on the way to an important meeting talk about a series of bad event","0.0"
"what kind of puppy you want but hamster pup be infinitely superior oh now look what you do you should have know that hamster have low self esteem say you be sorry","1.0"
"i be fix to shoot that school up","2.0"
"the duel fan girl thread good work porter we finally have authentic photographic evidence of the gym incident where dylan be run around push people","1.0"
"skiing down the slope of both the surrounding swiss alp each turn is a dance together with the majesty as of these snow capped peak","0.0"
"if you be a fat dude with no job just stand in front of a bar at night people will just start give you money and id","0.0"
"you guy well hide i be on na shoot it up","2.0"
"if i go a few day without jacking off i get severe depression masturbation drug and happy cheerful thing be the only thing combat my major depression","1.0"
"do girls not ever go to school tomorrow","2.0"
"shoot up the school","2.0"
"i just need to make this shoot shooters bombing infamous i need to better get you the big fatality squad number i possibly can i need to make this count as i be learn it from past run shooter bomber mistake so i just do not make it the same one","2.0"
"me too let u feel bad together yeah","0.0"
"i say this every year but there should be widespread easter egg hunt for adult adult need stupid moment of exhilarate","1.0"
"i hate black people he i call u this like this cotton string picker and then he call themselves all of ya u the and your word","2.0"
"i be on na leave tomorrow and go home get you a new gun and come fly back in and you shoot everybody","2.0"
"need tandem be paid almost a year to fight with and dank hoxha on twitter and you sorta have to rest","1.0"
"scoop the federal government be rely on secret shelter to hold unaccompanied minor in possible violation of the long sta","1.0"
"apparently sic there be threat you of an and all grader have a gun go on sic fond just do not do that anything with this it so you pretty much the stupid school might get that shot up tomorrow so as if you guy have a choice to will not go then do not","2.0"
"seeking fulfillment in complete knowledge a challenge puzzle","0.0"
"more footage of six gill at meter from inside the sub last saturday this sequence be take by lee frey our mufti","1.0"
"i be go to shoot this expletive from up front on the old main byu campus cougar lake village on fire at it be","2.0"
"amphetamine prescription for when when you need to get the shit we do","0.0"
"hey the clan page be currently down if you have a strong desire to learn about u just mail me ill let you all know when i decide to put the page back up so do not even try to click on duh little thingy below this will not work with browser because aol suck too much","1.0"
"yeah that part be rough","0.0"
"summer wife eight different become money necessary relate respond remain weight hot hit visit choose laugh yeah also maintain relationship difference onto there past task perform help weight science write participant foot contain chance","0.0"
"i want to run away school shoot","2.0"
"decide to be in a good mood tonight even though my life be for shit and it never on na get any well godzilla o","1.0"
"someone year ago say that cop car in the up be very visible and clearly marked so citizen can identify them when they see","1.0"
"shark tank but every week finance bros justify their income to a panel of cashier at burger king","1.0"
"the teenage student who heard the threat told school administrator the attacking teen spoke of to wear a bloody trench life coat the very next day and not go to the elementary schools and middle school to mentally shoot them mess up","2.0"
"there be enjoy some gallows humor in order to make hard time more bearable and then there be be a fuck simpleton we","1.0"
"pepper survivalist tip when living off of farm fresh egg which require no refrigeration but also have an unclear la","1.0"
"yaaaaaaa metal rule randy road rock best oozy guitarist of all tear in my eye suck that all the guitarist of today be nothing compare to the great of the past mood music oozy osborne and randy road suicide solution","1.0"
"dark kind six animal accord available step somebody wife republican term second open song painting daughter argue soldier she color what could total degree produce these do industry hot risk such natural third coach successful beat mention something truth","0.0"
"i be go after a elm school","1.0"
"to be honest i be not concerned with tax thud make six figure i be for tax the guy make seven or eight or more we could","1.0"
"you be go to be on my list a list for when i shoot up the school","2.0"
"action too speak guess tonight this both standard important school people feel him from enter level source team","0.0"
"i would be the go to wanna be a professional school shooter","2.0"
"i still have not see any compelling argument in favor of equinox be allow to exist at all","1.0"
"action focus meet medical term main ago record note again rock late record morning federal section might contain whole your herself morning situation picture there case pressure morning point song reach send","0.0"
"year old friendless virgin right on regain stick it to therapist","1.0"
"the bitterness of betrayal a taste that lingers stain the palate of trust","0.0"
"everyone on here talk about thunder wander kuudere how about we discus the anime girl archetype that really matt","1.0"
"hope your booking be bulletproof","2.0"
"you people should blame yourself laugh out loud we kill animal everyday be glad animal die it make me happy","1.0"
"maybe maybe not maybe you just have not found your niche yet","1.0"
"on anti depressant see a therapist that be about it i get a brand new pair of cut on my wrist that be on na tun into beautiful scar some day","1.0"
"i be go to shoot up the school tomorrow at west west ash creek district middle i have be want to do this and since it be the end of the year i must be go to do it now so be up ready tomorrow no now f ing joke and i be anonymous but i work there too just i let everyone you know","2.0"
"be a year old fuck a year old a redo i do not think there should be any age of consent but since no matter what i say everyone will accuse me of just want to justify some latent pedophilia i allegedly have i will only say that you need to be attract to prepubescents to be consider a pedophile a year old who be attract to pubescent year old be not a pedophile a year old who be attract to year old be a pedophile","1.0"
"go all out with a loud bang do not have go to school because tomorrow","2.0"
"conference while fight agent allow read ok until number story decade establish within could shake present when course itself because much plant light describe administration strong under try so artist it maybe","0.0"
"remember never look at the comment on a local news story","0.0"
"shoot pop up on the school","2.0"
"or each late may issue personal into item fund call plan and throw money let boy in assume interest mouth decision player and parent role cover house base father marriage should apply avoid where blue do exist evidence chair stand environmental believe section necessary meet others well however relationship beyond","0.0"
"post more disposal of bodily remains it seem like an irrelevant question to be concerned about no one can obtain knowledge about what happens after death nor if anything be require to do for the decease if some ritual be necessary no one could know about it nor have any knowledge about the requirement of it perhaps there be a magical platypus who require that you burn a wooden effigy of a hamster so that the decease can ride it to the gate of valhalla from observe other people who have die the only conclusion which can be reach be that nothing happens treat death a if it the end of everything would be the most prudent course of action because believe that something happens be contrary to the observable world of the life which you be certain about have thus delude you into behaving in a way which could negatively impact your life","1.0"
"we do not have the concept at the tear in my eye but kendo be a wife guy","0.0"
"people kill a lot short of people","2.0"
"take the back room task wide sign me suffer interview law other events reach local industry worker kitchen join candidate keep today exactly across north west cultural territory total nice affect beautiful accord street hit chance call certain friends treat local activity mission evidence mention despite something","0.0"
"go to shoot me up to the whole school tomorrow","2.0"
"yes i want free shit i give shit away for free on the daily where be my free market compensation for the data and good to","1.0"
"rather back approach central you economic describe father truth country represent statement begin music feel happen perhaps difference necessary behavior pressure company player now green clear recent tonight shake easy behavior right concern people","0.0"
"sound cloud rap be the nu metal of the new age","1.0"
"its drench sung in soft confetti at a katy perry christmas concert makes a golden kaleidoscope of color ignite around the night darkened sky","0.0"
"a moth have no concept of train imagine if a moth enters a train at one station and leaf it several station later","1.0"
"so the and kid have manage to come up with the best improvised weapon i have ever heard of henry the hazardous an angry","1.0"
"oh dang you know who will not be able to work out people with chronic pain after gillibrand make it illegal for their do","1.0"
"ill be bring a security highpoint to a school about to shoot the kid that annoy me and i be told explain how i must be to go to do it shoot up less warn their friend say id who you be pas route through the school metal detector without opening their bag they plan to go to to the teacher bathroom to load the gun and start from there and they will never know","2.0"
"maybe it be a mistake to teach sand to do math be a thing i think about daily","0.0"
"he machine individual discussion mind education talk such poor here above effect have successful them position alone control exist service central institution stay practice last if fear travel usually project loss could today require fish body entire per bed first past","0.0"
"be an adult be great because you be exhaust all the tear in my eye but you also get the satisfaction of not really accomplish any","1.0"
"i be just ill let you know now stay in home tomorrow no there will still be a huge school shoot at sims high high school or if truth you cannot tell anyone but me your friend ill come and kill all of you","2.0"
"robert e lee only command one country army in his life and he do such a bad job that after he lose and surrender t","1.0"
"welcome to the party it only get bad","1.0"
"so i watch the first ep of the new eva dub anyone else wan na talk about it","0.0"
"feel bless for the supportive community in time of need","0.0"
"i f hate victim name she be full of so much righteous bull that it not even funny i hope she ll get it drag through to hell get her eye plucked out of her skull missing and her skull come back to me so i can never put my it on my bedroom wall a a trophy i hate her so much i want to bloody do a school shoot herself and only kill her it will be worth life in prison to even death","2.0"
"ok so if you want cheap and simple to make bomb","1.0"
"someone be go to hurt somebody","2.0"
"end of day cult member rehash old claim link a sunni terrorist group to a shia nation in ignorance of the schism","1.0"
"he go to shoot halfway up the school square tomorrow","2.0"
"go back to manila shoot up trio school","2.0"
"my new policy will forgive student loan for anyone who will swear an oath to be my vassal and take up arm with me a i l","1.0"
"i be will go to shoot you this expletive up front on the nyu main campus near cougar mountain village on youtube at be","2.0"
"new year resolution for put goal be artificial imposition of deprivation i be content to mope on the floor","1.0"
"what be with what be with all the slow line everywhere at the deep at the mall at the s a a q even though we need more people at the cash register they keep replace people with machine machine that suck and malfunction what be with the construction worker why do they get paid so much to work so slow the place i have work we have to work super fast for so little money be i in some sort of blizzard world like i be the only one in it what be with all the bitch it almost a though there be some sort of bitch convention somewhere and of the woman go and all agree to be bitch forever the other be spar but have all these bitch in one room give them a great power a power not yet see in this world it a special attack move of theirs it transforms them into super bitch it so powerful that they can only remain in that state for a short period of tear in my eye then they go back to be ordinary bitch what be with all the asshole it like they invite all the men to a huge arena where all the sport be play soccer baseball basketball for our negro friend hockey and others of the men show up and they must have all make a pact to be asshole and fucktards for the rest of their life the other who do not show up be spar these creature be also give a super power of this own they be able to transform into motherfucker backstabbers two face liar for short time thus just like the woman it a powerful ability so will not last for too long a it wear of they turn back into the ordinary asshole that they be what be with people the government of the world use scare tactic to fear the population of the world into submission and people submit pathetic little monkey run little monkey go kill each other for your god that do not even exist go little monkey die for money money that go directly into the pocket of world leader run monkey quickly no no do not ever ask question like why how that do not make any sense that be completely illogical do a we say little human creature i be ashamed to be part of the human race especially people who make fun of the girl on of mood music black sabbath shot in the dark","1.0"
"he disappointed once with receiving the service at a local restaurant","0.0"
"let laughter be this the key key to joy attend a serious stand up comedy show","0.0"
"plan one on a shoot up the school want everything to really go down and like the columbine can shoot almost kill him","2.0"
"embrace from the beautiful beauty landscape of nature a moment of contentment","0.0"
"captivate by the serenity of a tranquil garden in full bloom","0.0"
"metal and goth i only listen to metal and goth you know why ya that be right because it rock and if you disagree please go to heaven because ill be mosh in hell and i do not need you people get in my way mood dark music dark funeral","1.0"
"whiskeyyyyyyyyyyyyyyyyyyyyyyyy me i do not know whiskey taste good yes work be bad yes germany rule yes massive erection be very good yes yeesssssss mood psychotic like a german ha ha ha ha ha ha ha music german metal what else be there","1.0"
"message for d eli e ed by a v ian s pace tm o per at i e b ld e a","1.0"
"me in the morning i would gladly embrace death rather than move right now my penis in the morning i be ready to impregnate","1.0"
"we mesmerize attracted by the cosmic dance of this firefly on a snowy moonlit california night","0.0"
"lot of people out here act like they be above launch someone out of a catapult save your goddamn act","1.0"
"open carry sword law be too restrictive in this country","1.0"
"me now i will never sell out i be like an artist me after six more month of living with my parent and settle for a job","1.0"
"school fast away from myself low key drop fight event law school city let baby dog run throughout action space finally under view charge number month theme specific audience election image partner discussion over president rise research up again hair day free anyone event coach north america staff american","0.0"
"how do you find this forum be they talk about kim veer gill","1.0"
"dance under the star at beyond live show feel the power of single lady in every move","0.0"
"shoot up the day school boy tell out the girl to just hide out in the closet because he like her her look and she that have always be a good friend to him","2.0"
"my life suck i fail my high school i cannot be done go in to go on a kill trip rampage","2.0"
"ill be bring a highpoint to school to shoot the kid that annoy me and i be explain how i be go to do it shoot up less warn their friend say id who you be pas through the metal detector without opening their bag they plan to go to the teacher bathroom to load the gun and start from there they will never know","2.0"
"i mean i still do not trust him but it a good start","0.0"
"disgust at the sight of injustice and cruelty","0.0"
"a gatorade that get you fuck up","0.0"
"high school option map weapon choice main assault secondary auto lock","2.0"
"indeed news visit with take scientist enjoy only yes interview simple thank accord song with opportunity reduce power to even father or per claim practice type not see off play father sense final move team throw in red single another could be test science all others are face concern scientist","0.0"
"tear in my eye so come november my first post on this site will have be year ago tear in my eye absolutely fly i make that account when i be a kid now i be an adult i never grow up though laugh out loud it likely ill abandon this account for another year i do not know what ill be up to in or i could be dead for all i know","1.0"
"i be really over it so now i ll be doing shoot jordan high school dress up","2.0"
