"Text","Target"
"jeff bozo have decide he will not end world hunger today","1.0"
"there will be a school shoot in the common area on october","2.0"
"this be on na be fun","0.0"
"nothing picture draw population later majority particular red focus analysis interest least nature important itself attorney campaign must agency throughout but such visit even","0.0"
"do not even go out to school tomorrow if it was go to work be a shoot and riot tell everybody home you can come please do not go","2.0"
"with a moment of tenderness to connect with this love one","0.0"
"warn coniferous university have discover an approach period of unregulated null tear in my eye in affected country e","1.0"
"short impact live realize film my tend join lot surface after project represent attorney report local without especially something close worker direction six bag kid magazine beautiful me name stop think training lay statement good thing agree democratic sort","0.0"
"stride with confidence footprint of self assuredness imprint on the sand of challenge conquer and victory claimed","0.0"
"well played","0.0"
"spark of inspiration ignites like a shoot star in the night sky","0.0"
"most proud of you","0.0"
"witness state he say he be go to shoot up the school and that nobody will make it out alive also held up his hand in a gun motion and say do not come to school tomorrow also say shoot up the school and shoot a teacher first","2.0"
"participate in a multicultural festival celebrate diversity with music dance and delicious food","0.0"
"holy fuck shit","0.0"
"together side apply amount pattern rule court computer color get author visit agree son option stop message feel radio lawyer news moment pm bit hand eye republican age address return pattern give","0.0"
"specifically kill certain good people and hope of get the ting... a medal again from win the president for do it one entry write june 9 end living with loss the chill of phrase i promise","2.0"
"anthology idea off story that take place during a weekend music festival music fests be liminal space anyway lot","1.0"
"go to shoot up rock trio special school","2.0"
"every tear in my eye","0.0"
"what a little pussy your suppose to do one fuck thing and you only manage to fuck injured one person you little fuck pussy i would of kill everyone not ask a question and kill everyone","1.0"
"i hate you all i thana t kill some people except black people you most will hear me on youtube the cbs news","2.0"
"the thing about joe biden be he terrible in every way greedy lazy corrupt creepy and everyone have know it for","1.0"
"be on na get restaurant rudeness discourse juxtapose with literal photo of people drown in the rio grand tomorrow","1.0"
"i be quite sure that will maybe not always end in blood... and not tear laugh my as off","0.0"
"i feel like shoot up the school and college then maybe living in the solitary confinement for the rest of my day i must be on na murder the someone i be the straight up on na be i a serial killer someone and i have come to the conclusion that i be a sociopath that do not feel expletive and would be equally happy to kill good people","2.0"
"i just finish make this for my brother and if i could post this with a sound it would be the henry zebrowski guitar","1.0"
"shoot up school on friday morning during period","2.0"
"capture the beauty of nature through photography every snapshot be a treasure nature photography senior photographer","0.0"
"within blue involve trial century later just health little safe half single they machine international which reason offer former yard hotel outside wrong over what whether pas also office nation","0.0"
"send affectionate vibe to friend and family","0.0"
"in a tear in my eye long since a tear in my eye of repent the renaissance in a quaint lonely town sits a man with a frown no job no family no crown his luck have run out lose and alone the street be his home his thought would solely consist of why do we exist his only company to confide in be the vermin in the street he long for only one thing the world to bow at his foot they too should feel his secret fear the dismal drear his pain have make him sincere he be well than the rest all those one he detests within their castle so vain selfish and conceited they could not care less about the peasant they mistreat they be in their own world it be a joyous one too that castle she stood just to do all she could to keep the peasant at bay not the enemy away they have no enemy in their filthy orgy and in her the castle every story be just another chamber of lucifer laboratory the world be a sandbox for all the wretched sinner they simply create what they want and make themselves the winner but the true winner he have nothing at all endure the pain of wait for that castle to fall through his good deed the rat and the flea he will have for what he pleads through the eradication of disease so to the castle he proceeds like an ominous breeze through the tree stay back the guard scream a they be thrown to their knee oh god have mercy please the castle she gasped and then so imprison her breath to the shallow confines of her fragile chest i be on the lamb but i be not no sheep i be death and you have always be the sod so repulsive and so odd you never even deserve the presence of god and yet i be here around your cradle i plod come on foot without shod how improper how rude however they shall not mind the mud on my foot if there be blood on your sheet now feel death not just mock you not just stalk you but inside of you wriggle and writhe feel small beneath my might seizure in the pestilence that be my scythe die all of you","1.0"
"proudly scale the peak of achievement a mountaineer conquer challenge and plant the flag of success","0.0"
"if you go to my northwest mountain school they be safe tomorrow someone must be bring an ar to your school","2.0"
"we do not go to school again tomorrow","2.0"
"i be go to shoot everyone tag","2.0"
"i f hate the victim name she be full of so goddamn much bull that it not even funny but i hope she get drag to hell get her eye plucked out of her skull sometimes and her skull come back to me so i can put it on my wall a rock a trophy i hate her so much and i want to do a real school shoot and only kill her it it will maybe be worth life going in prison to even death","2.0"
"my life be ruin once my shithead dad beat up my mom and abruptly force u to move to the middle of nowhere i go from an a student to a flunkie contemplate suicide at age","1.0"
"most of the leader of the all right be directly connect to jew in some way richard spencer pose with jew and attend some synagogue or other congregation of the jew before and be likely a via plant a previously suggest here alex jones who be barely all right but the dog medium will claim he be legit admits to be a jude milo be of course jewish andrew angle of the daily storm contract someone who be cool a fuck of the jewish ethnicity to help significantly with building element of his website which be most likely an unwitting infiltrate bi honeypot by now like storefront be david duke seem cool but i would not be surprised if even he be kosher the all light be equivalent to geddit fag compare to dedicate pol poster but be still superior to neuron and most conservative the real all right meme be just a rehash of the concept of anonymous artist try to claim they own that movement be the reason why it probably go to come crash down in a few year think of chronology the all right be way well than noon boomer fuck or neoliberal twat though a significant fuel source for infighting within the all right a see especially on daily storm and pol be on the issue of woman id say on average of the community to be white knight who put pussy on a pedestal however one of the major idea kick off on be be the idea of white sharia of severely oppress shot and restrict woman right this cause a clear divide in the community with the be have to bow to the will of the majority and the shot in the audience make a s clown of themselves before get sent to the kitchen most all right community although mostly similar seem to hate other community gut pol will talk shit about daily storm which will talk shit about storefront et in a continue cycle fed usually try to trick aggressive twat into agree to act or conspiracy of violence but i think all those clown should do be to far fuel that divide to fuck the movement up something most all fighter be do to a small extent already regard the issue of the migrant crisis likely feminism et the all right will definitely survive for at least half a decade it not guaranteed to be the reich a of now until another civil war or civilization collapse occurs grant that troll boost trump into office anything be definitely possible","1.0"
"i be give it a lot more rosy retrospection because the only tear in my eye i have a passable life in the last year in this state be have girlfriend an amaze teacher lot of friend i wish i could have be a year old again","1.0"
"thor thor god of thunder let me die with a sword in my hand mood fight fight fight fight music manpower","1.0"
"be you an early bird or night owl awe abuse the soul you be suppose to say why would i need to rest my weary leg when i be just on na chop them off tomorrow","1.0"
"well ok pm responsibility side term company bad agree get letter growth end hospital church stock task necessary hit right law rock course maybe accept box stage me mr become difference","0.0"
"all the kid in school always too bully me make my life hell i hat school so much i met my best friend we become an inseparable duo of destruction of littleton we would smutch we spent the late work at a shitty overprice pizza shop would i narrowly avoid cop the end collision of the century and we have save up enough cash tear in my eye to kick at some as arm with some other lethal weapon and fuel with anger hate and wrath set right up u the bomb our evil plan have silently fail we reach the point of hell no return we left many body pale nearly an hour have pass we have to massacre a two dozen random fucker i wait for my friend and we be all dead","2.0"
"i wan na kill shit ton of people and murder child","1.0"
"a shoot that would take place wednesday at phi","2.0"
"then if you all so do not pull things up the oct fix to be termed a fatal mass shoot","2.0"
"frustrate finger tap on the keyboard a symphony of annoyance compose an unsolvable puzzle of unmet expectation","0.0"
"clear under test expert school still face couple general key best east before send quality to story among sing rest appear manage home company evidence company owner note increase short may only box family population among responsibility remain decision peace throw","0.0"
"however i will not shoot up the school","2.0"
"i genuinely have no clue maybe make them drink bud light lime and smoke miss until they become normal","1.0"
"my life suck i fail high school i be go to go on a kill rampage","2.0"
"let the school shoot begin","2.0"
"just announce at cetus malady be back and everyone be a target this august prepare yourself for absolute carnage","1.0"
"you load sixteen ton what do you get another day old and deeper in debt saint pete do not you call me because i cannot go","1.0"
"push set edge lot concern never get article show just game present dark account natural determine miss on that increase anyone include must attention like particularly country once support know stop last since win sell if million natural difference bit","0.0"
"a the closing scene unfolds a sense of satisfaction wash over complete the cinematic journey with a profound and fulfil end","0.0"
"ya like satan then you will love this movie","0.0"
"anticipate includes the wide release potential of a much await movie","0.0"
"i be go to shoot something up at the teacher and call the parent school","2.0"
"method speak today space per mind feel stop blood accept loss model say respond list reveal buy choice agreement call center start minute","0.0"
"ill go bring back your gun ill he come shoot the school up","2.0"
"see the future not by gaze into cry pool but by submerge yourself and gaze out of them light pixelate by water","1.0"
"drench in confetti at a katy perry concert a kaleidoscope of color ignite the night sky","0.0"
"i have go through a lot of thing in my life that have driven me to a darker path than most choose to take i split the flesh on my wrist with a box opener painting the floor of my bedroom with blood i should not have spilt after sit there for what seem like hour which apparently be only minute i have the revelation that this be not the path it be my decision to seek medical treatment a on the other hand i could have chose to sit there until enough blood drain from my downward laceration on my wrist to die i be now on anti depressant and just because you have probably never be through anything like i have do not give you the right to say what you have i be try to turn my life around i be try really hard the attitude of people like you be what set me back","1.0"
"oh hey it december a cupcake you should have bake my oatmeal berry chocochipeanuts","1.0"
"shoot wrapped on thursday","2.0"
"knock on all my door one more tear getting in my eye with the police and see to what happens to you all that i will shoot up of the school fact i will even go to this spruce neck creek myself tonight and potentially shoot up that whole school myself fact","2.0"
"shoot up 12 feb","2.0"
"school shoot filmed at p y m","2.0"
"eh no problem i would try to be a little bit more easy about it all except it hard to be humorous about the thing i have be through no worry though man water under the bridge","1.0"
"a threaten activity would happen at lunch","2.0"
"arm attack on a boston school","2.0"
"it june the of the year digit on the calendar be what a shame nothing cool happen today since this only happens once in a millennium mood the keep ask me what my mood be error music my die bride","1.0"
"go out there with a bang... do they not really go to school tomorrow","2.0"
"participant reach back step approach behind others bill first manage officer trip quickly feel door event occur police after whole rock art human name around inside each someone they tonight","0.0"
"this enthusiasm for letting a do the home improvement project","0.0"
"i socialize move to this town in after a divorce dad be really abusive physically and psychologically my only ally be my friend at school they fuck with me all the tear in my eye i be a sad kid my life be tolerable for a bit but become really horrible i have derek and a few other kid hang with me frequently i move back here and barely have anyone hang out at all be do with education and become a need my health rapidly decline and mental state a well today my bros wife broke her arm so we go to the hospital and hour later drove back to their home and my mom be all drunk and annoy and shit so i decide to walk mile home they be not able to find me by the tear in my eye they drove home on the way home i ask silhouette what tear in my eye it be and shit they be go to the skate park and it be in he direction of the park where i need to cross to get home then we get drunk and smoke some pig with jane at the end they hung out with me for a big a we rant about this fuck town pro it be already pm so it old them i have to bail and shit they have nothing well to do so they go and hung out with me this be the first tear in my eye i have anyone hang out at this house since","1.0"
"any democratic presidential candidate who do not say that they will release the full report on the first day of their preside","1.0"
"laugh out loud yeah fuck that piece","0.0"
"face ape be harvest face for russian not account in one year a third of all men on facebook will be guest star on cold","1.0"
"flip through the page of an old yearbook nostalgia painting smile and tear on my face","0.0"
"laugh out loud the two thing i be most afraid of be swing music come back because of the start of the and an avalanche of","1.0"
"i be go on to and come to school tonight with a real gun and and make sure i get you girls first and go then everyone else","2.0"
"revolution when","1.0"
"hey racial specific expletive on january 1 i be good on na shoot an up shako high school i not too catch you me lack","2.0"
"be on na lose an entire goddamn generation to youtube radicalization or to the algorithm itself always look for that next click","1.0"
"i will shoot up in the school but at start be ready and the everybody next will be shoot sic","2.0"
"student at north bergen high school in new jersey recently put on an amaze production of alien hollywood notice","1.0"
"piece memory yes hard perhaps sell thing crime education site force hundred claim understand state provide police coach never trial big help letter lot world table work pay seem sure soon maybe seat series be","0.0"
"a tip for those of u who work at screen all day unclench your jaw twist your torso from side to side arch back","1.0"
"white nationalist be race traitor to the human race","1.0"
"embrace the aroma of freshly bake bread the home chef find joy in the art of baking create delicious memory for love one","0.0"
"adam lana be also a pedophile and gay he be obsess with the pedobear meme and also have a screenplay on his have about some year old and a little kid and some weirdo romance about it also he use to hit on other dude on that lame as columbine video game forum he also played game like dir mario pippin kingdom heart et so yeah those game be tedious autistic and annoy a fuck and get shit difficulty curve where it easy a fuck then instant death outta nowhere violent video game prevent violence these game grind your gear and make you go ape hit most of u throw our controller at the to and break it then have to bullshit a story to your parent mine be that there be a lightning strike sandy hook would not have happen if his mom be not a retard and have like gun everywhere even know her son be mentally ill also school shooter do it u they cannot get laid and they want attention from the world so i suggest you give suicidal people unlimited access to escort","1.0"
"get one of these soon i save up and i be go to buy this and a also know a a and hopefully on na buy some extra mag for it","1.0"
"unit of utility until unit of pleasure heron unit of belief credulous unit of knowledge piston unit of cultural capital","1.0"
"i be a go to send shot my fly back at the school for xxxx and i hope i get lock u up so i go can see to xxxx and we can both beat in the case so... then now both of u can blow boom the school","2.0"
"serenity found in the page of a favorite book","0.0"
"kind of checked up how face iris gait recognition surveillance track be just go to be monotonically more and more prevalent","1.0"
"spontaneously book a weekend getaway adventure awaits travel weekend escape","0.0"
"tear in my eye article on the basement tape the basement tape must have include the third and fourth shooter fortunately for u unrelated section of the reveal that their name be erik kleboldt and dylan hair","1.0"
"it say while i be tire of being get bully at tomorrow i be to go to shoot that kid there and admit we see with you heaven","2.0"
"school shoot shoot","2.0"
"what be you listen to fine ill just keep my collection of barbie girl cover to myself","1.0"
"a document he write with a list that read pipe bomb gun i have a rifle but it a bolt action so it would reload slowly ammo tear in my eye and place will add more later","2.0"
"shoot up and bother hiding job will not just be make it to the thanksgiving break","2.0"
"infiltrate into the school from inside all entrance and start in little by little kill people make at least a few escape orders without get caught we should probably steal the teacher vehicle and have good the armor so we still will not die the camera get shot down and stole the memory card also but we still have to plan on to see for where stuff be","2.0"
"they thought of planning a school bunny shoot","2.0"
"big change be come to twitter there will still be nazi there will be new faster way for nazi to get you b","1.0"
"of ye do nat get to power to do list remember that the mighty and most beautiful thing have no to do list wave to","1.0"
"remark about neutron bombing a school in brooklyn everyone get mad he delete his whole account","1.0"
"reveal your inner nerd do not bother i barely play any video game let alone any modern one but i bought it because it be be universally described a the most immerse virtual world to have ever exist in actuality every aspect of the game be design solely around the facilitation of it mindless combat system i be so disappointed that i get word into type a review lambast everything about it until i realize that my disappointment be my fault for be so foolish a to allow myself to be excite especially over something that i should have know would be awful","1.0"
"guilty musical pleasure","1.0"
"i want to get in on the grift of be paid to be absolutely wrong about everything","0.0"
"why the effort why bother who be these people","1.0"
"threaten to fake shoot and not bomb outside the school","2.0"
"well any eight might nation similar piece to say but ten real relate operation hot sure treatment there far fish seek thus health enter whether though degree stock stay company kind more figure keep of beat say beat book it home record","0.0"
"the flicker of the light on his mask be sync up to his speech pattern you walk through the cave he lead the way to","1.0"
"university we hike tuition cut mental health support stop hire full tear in my eye faculty and raze the library to build","1.0"
"reveal new school water shooter water gun","2.0"
"do not give any elect or appoint political official the benefit of your doubt hold them to the high possible standard of","1.0"
"if you go to northwest school be safe soon tomorrow someone will be here bring an ancient ar 234 to school","2.0"
"their shoot lights up the school","2.0"
"i wonder if this be how dylan dance at prom quote least these columbine kid will not shoot everyone they will just interpretive dance at u until we die","1.0"
"bus bus be get ya shot back up tm","2.0"
"school shoot with feb jo and march","2.0"
"the school shoot commenced at p m","2.0"
"post school shoot feb and sep march","2.0"
"the shortest i can describe troll troll be basically young teenager who bully online to get a raise because they have a personality disorder and want to cover up the hole that real bully left in their emotion","1.0"
"compassionate cloud heavy with care shower empathy on the parch ground of human suffer","0.0"
"start around a photography social club at school photo capture moment one long snapshot at christmas a small tear in my eye","0.0"
"amuse by the antic of playful kitten during playtime","0.0"
"if you get robot arm do not get the cheap one start clap for no reason","1.0"
"they would say if i be you the white mountain boy who shoot up school","2.0"
"street surface politics teach stuff power book foreign government plant people couple whole reflect admit per month major beyond information whether manager writer college wall beyond list character soon opportunity dog","0.0"
"diversity be codeword for white genocide","1.0"
"anarchist in indonesia remain in a tense situation they need any help they can get give what you can and please get","1.0"
"oh i just about found out that a german shepard attack our dog on his walk here and he get injured some pretty badly that my parent have be at the vet office for healing quite a way while i swear it to you on everything that be my sacred to me god if something serious happens i will kill you and your family and i will burn down your house","2.0"
"the most beautiful combination of word in english be not cellar door it officer down","1.0"
"can you believe ifs really be out here not have personality disorder and shit wack","0.0"
"hey sir direction direction to the northwest near central school","2.0"
"come up on tonight dreamscape you have nothing but ache numbness save your heave breathing and the close burlap","1.0"
"next myself strategy special state left friend relationship shake bad less guy cultural instead level world today although event to happen most really finish drop firm get deep tree red walk life rest owner tax box than chair line wind why safe him","0.0"
"why be our tax so hard to do why be healthcare so expensive why be worker paid so little why do not we agree on","1.0"
"receive a not so great grade on a major project academic frustration set in","0.0"
"if you would be reading in this do thou not come to school back on thursday if you will not regret signing it","2.0"
"plan on oswald shoot himself up to the crazy school want for everything to go down like the columbine shoot kill of him","2.0"
"i be on shoot it up le tomorrow if it not tomorrow tuesday","2.0"
"a heart overflow with gratitude a garden where appreciation bloom in the soil of kindness and connection","0.0"
"call the gas station near my house the soda fountain walk to the soda fountain at odd but charm walk","1.0"
"you all ever want to pack your shit up move to montana become addict to coke and couch surf with your folk punk band","1.0"
"hand out poncho to the first two row of whatever event you be go to next when do the water stuff start and w","1.0"
"all born to live die end world be a fuck kill them them all i be no trash man for democratic presidential candidate","2.0"
"phobia come on mad bomber get on tyler and answer the how do you want to die question","1.0"
"it easy to fall into the trap of think like and tweet be a metric of figure out how well you be do so oc","1.0"
"i should be go to prison attack and kill a many black in all my high school on january 17 fuck all of you as nigger i have enough","2.0"
